tipo,titulo,direccion,precio,terreno,construccion,hab,baños,estac,pisc
Apartamento En Renta,Apartamento En Alquiler En Lecheria Resd Tepui Caribe,"Diego Bautista Urbaneja, Lechería, Anzoategui",270.0,42.0,42.0,1.0,1.0,1.0,True
Casa En Venta,Casa Bote C,"sector aquavilla, Diego Bautista Urbaneja, Lechería, Anzoategui",2000.0,201.0,120.0,,,,False
Apartamento En Venta,Lujoso Apartamento Dúplex En Planta Baja Condominio Isla Marina,"Avenida La Costa, Diego Bautista Urbaneja, Lechería, Anzoategui",245000.0,194.0,164.0,,,,False
Apartamento En Renta,Alquiler Apartamento En El Conjunto Residencial Punta Canal En Lechería,"Sector la Salina, Diego Bautista Urbaneja, Lechería, Anzoategui",700.0,120.0,120.0,3.0,2.0,2.0,True
Apartamento En Renta,Se Alquila Hermoso Apartamento En El Conjunto Residencial Marina Del Rey,"1, Diego Bautista Urbaneja, Lechería, Anzoategui",350.0,46.0,46.0,1.0,1.0,1.0,False
Apartamento En Renta,APARTAMENTO EN ALQUILER EN PUERTO PRINCIPE,"Avenida Daniel Camejo Octavio, Diego Bautista Urbaneja, Lechería, Anzoategui",400.0,135.0,135.0,3.0,2.0,2.0,False
Casa En Venta,"Amplia Casa Equipada Y Amoblada En Una Excelente Zona, Muy Bien Ubicada","Neveri, Diego Bautista Urbaneja, Lechería, Anzoategui",295000.0,509.0,400.0,6.0,5.0,9.0,True
Apartamento En Venta,Lujoso Apartamento En Venta En El Conjunto Residential Doral Beach,"Diego Bautista Urbaneja, Lechería, Anzoategui",42000.0,120.0,120.0,,,,False
Penthouse En Venta,"Espacioso E Imponente PENTHOUSE En Residencias Oasis, Casco Central De Lechería","Calle Merey, Diego Bautista Urbaneja, Lechería, Anzoategui",250000.0,375.0,375.0,4.0,4.0,2.0,True
Apartamento En Venta,Apartamento En Venta En Lechería A Estrenar En El Prestigioso CR. Casa Mares,"Av. Principal de Lechería, Diego Bautista Urbaneja, Lechería, Anzoategui",145000.0,96.0,96.0,3.0,2.0,2.0,True
Apartamento En Venta,Apartamento En Lechería En El CR Costa Guaica,"Costanera, Diego Bautista Urbaneja, Lechería, Anzoategui",55000.0,86.0,86.0,,,,False
Local En Renta,Local A Pie De Calle Lechería,"Venezuela, Diego Bautista Urbaneja, Lechería, Anzoategui",300.0,30.0,30.0,,,,False
Oficinas En Venta,Oficina En Lechería,"venezuela, Diego Bautista Urbaneja, Lechería, Anzoategui",31000.0,26.0,26.0,,,,False
Local En Venta,Oficina En Venta Lechería,"venezuela, Diego Bautista Urbaneja, Lechería, Anzoategui",38000.0,29.0,29.0,,,,False
Oficinas En Renta,Oficina Lechería Alquiler,"venezuela, Diego Bautista Urbaneja, Lechería, Anzoategui",400.0,29.0,29.0,,,,False
Apartamento En Venta,En Venta Apartamento En El Conjunto Residencial Morro Humboldt,"avenida camejo octavio, Diego Bautista Urbaneja, Lechería, Anzoategui",25000.0,83.0,83.0,2.0,2.0,1.0,False
Apartamento En Venta,"Apartamento C.R Alto Atlantis, Las Garzas","Calle Sur 4, Sector Las Garzas, Diego Bautista Urbaneja, Lechería, Anzoategui",40000.0,72.0,72.0,,,,False
Town House En Renta,TOWN HOUSE EN ALQUILER EN PUERTO PRINCIPE,"Avenida Daniel Camejo Octavio, Diego Bautista Urbaneja, Lechería, Anzoategui",550.0,120.0,120.0,3.0,3.0,1.0,False
Casa En Renta,Cómoda Y Acogedora Villa En Alquiler Vacacional,"Av Camejo Octavio, Diego Bautista Urbaneja, Lechería, Anzoategui",1000.0,1.2,700.0,6.0,8.0,5.0,False
Oficinas En Venta,Moderna Oficina En Centro Comercial Venezuela Centro Lecheria,"venezuela, Diego Bautista Urbaneja, Lechería, Anzoategui",45000.0,33.0,33.0,,,,False
Apartamento En Renta,APARTAMENTO EN ALQUILER EN LECHERIA CR PEDREGAL SUITES,"Sector Peñon del Faro, Diego Bautista Urbaneja, Lechería, Anzoategui",250.0,40.0,40.0,,,,False
Apartamento En Venta,APARTAMENTO EN VENTA EN LECHERIA CR PUERTO AVENTURA,"AV R-16, Diego Bautista Urbaneja, Lechería, Anzoategui",83000.0,118.0,118.0,,,,False
Apartamento En Renta,APARTAMENTO EN ALQUILER EN LECHERIA CR KYNAKI,"Av Bolivar, Diego Bautista Urbaneja, Lechería, Anzoategui",450.0,95.0,95.0,,,,False
Apartamento En Renta,APARTAMENTO EN ALQUILER CR OASIS,"VENECIA, Diego Bautista Urbaneja, Lechería, Anzoategui",800.0,94.0,94.0,,,,False
Casa Bote En Renta,Casa Bote C,"Camejo Octavio, Diego Bautista Urbaneja, Lechería, Anzoategui",700.0,120.0,120.0,,,,False
Apartamento En Venta,CONJUNTO RESIDENCIAL DORAL BEACH,"AVENIDA AMERICO VESPUCIO, Diego Bautista Urbaneja, Lechería, Anzoategui",24000.0,95.0,95.0,,,,False
Apartamento En Venta,"Apartamento Conjunto Res. Aquamarina Suites, Av. Bolivar, Lecheria","Av. B, Diego Bautista Urbaneja, Lechería, Anzoategui",79000.0,109.0,109.0,3.0,2.0,2.0,False
Casa En Venta,"Venta De Hermosa Casas Botes C, Lechería, Complejo Turístico El Morro","Av. Camejo Octavio, Diego Bautista Urbaneja, Lechería, Anzoategui",170000.0,206.0,206.0,4.0,4.0,2.0,False
Apartamento En Venta,En Venta Apartamento En Marina Del Rey,"MARINA DEL REY, Diego Bautista Urbaneja, Lechería, Anzoategui",80000.0,55.0,55.0,,,,False
Apartamento En Venta,En Venta Apartamento En Marina Del Rey,"MARINA DEL REY, Diego Bautista Urbaneja, Lechería, Anzoategui",70000.0,66.0,66.0,2.0,2.0,0.0,False
Town House En Venta,Town House En C.R Costa Del Sol,"Calle Principal, Diego Bautista Urbaneja, Lechería, Anzoategui",170000.0,135.0,135.0,4.0,2.0,2.0,True
Apartamento En Venta,Apartamento En El Conjunto Residencial Marina Del Rey,"Av. Americo Vespucio, Diego Bautista Urbaneja, Lechería, Anzoategui",43000.0,66.0,66.0,2.0,1.0,3.0,True
Town House En Venta,Residencias Guaica House,"maria rosa, Diego Bautista Urbaneja, Lechería, Anzoategui",120000.0,145.0,145.0,,,,False
Apartamento En Venta,EXCLUSIVO APARTAMENTO EN VENTA. EL MORRO,"Diego Bautista Urbaneja, Lechería, Anzoategui",350000.0,165.0,165.0,3.0,3.0,3.0,True
Casa En Venta,Amplia Casa Conjunto Residencial Guaica House Sector Morro IIILecheria,"Morro III, Diego Bautista Urbaneja, Lechería, Anzoategui",125000.0,150.0,150.0,3.0,3.0,3.0,False
Casa En Venta,Lujosa Villa En Venta,"Diego Bautista Urbaneja, Lechería, Anzoategui",1300000.0,800.0,800.0,6.0,6.0,6.0,True
Apartamento En Renta,Cómodo Y Lindo Apartamento En Alquiler En Guaica Real,"Diego Bautista Urbaneja, Lechería, Anzoategui",500.0,86.0,86.0,2.0,2.0,2.0,True
Apartamento En Venta,"Apartamento En Venta, Conjunto Residencial Mochima Puerto La Cruz","APAMATES, Diego Bautista Urbaneja, Lechería, Anzoategui",18500.0,81.0,81.0,,,,False
Casa En Venta,Casas Bote C Moderna Y Amoblada,"Av. Daniel Camejo Octavio, Diego Bautista Urbaneja, Lechería, Anzoategui",420000.0,200.0,391.0,4.0,4.0,3.0,False
Town House En Venta,Amplio Y Confortable Townhause En El Conjunto Residencial Villas Monterrey,"Calle Mara, Diego Bautista Urbaneja, Lechería, Anzoategui",110000.0,0.0,235.0,,,,False
Apartamento En Renta,APTO EN ALQUILER EN EL CONJUNTO RESIDENCIAL MARINA MAR,"AVENIDA BARLOVENTO, Diego Bautista Urbaneja, Lechería, Anzoategui",600.0,90.0,90.0,2.0,2.0,1.0,False
Apartamento En Venta,"Apartamento En Venta Conjunto Residencial ALTO ATLANTIS, Lecheria","Calle sur, Diego Bautista Urbaneja, Lechería, Anzoategui",43000.0,77.0,77.0,21.0,2.0,2.0,False
Town House En Renta,TOWNHOUSE EN ALQUILER EN LECHERIA CR LAS MARINAS,"Octavio Camejo, Diego Bautista Urbaneja, Lechería, Anzoategui",1500.0,273.0,273.0,,,,False
Apartamento En Venta,"*Con Alto Potencial En Una De Las Zonas Mas Prestigiosas ,","Av, Bolivar, Diego Bautista Urbaneja, Lechería, Anzoategui",95000.0,180.0,180.0,,,,False
Apartamento En Venta,Cómodo Y Lindo Apartamento En Venta En Guaica Real,"Diego Bautista Urbaneja, Lechería, Anzoategui",55000.0,86.0,86.0,2.0,2.0,2.0,True
Apartamento En Renta,Hermoso Y Amplio Apartamento Con Hermosa Vista A La Ciudad,"Calle Arismendi, Diego Bautista Urbaneja, Lechería, Anzoategui",650.0,98.0,98.0,3.0,2.0,2.0,True
Casa En Venta,VILLA VACACIONAL,"LAS VILLAS DE LECHERIA, Diego Bautista Urbaneja, Lechería, Anzoategui",550.0,1.964,1.964,,,,False
Apartamento En Venta,CONJUNTO RESIDENCIAL MARINA MAR,"Avenida La Costa, Diego Bautista Urbaneja, Lechería, Anzoategui",210000.0,229.0,229.0,,,,False
Town House En Venta,TOWNHOUSE EN VENTA N LECHERIA CR LAS MARINAS,"Octavio Camejo, Diego Bautista Urbaneja, Lechería, Anzoategui",255000.0,273.0,273.0,,,,False
Local En Renta,LOCAL COMERCIAL LECHERIA,"LECHERIA, Diego Bautista Urbaneja, Lechería, Anzoategui",750.0,170.0,170.0,,,,False
Town House En Venta,Town House Conjunto Residencial La Caleta,"AV: Octavio Camejo, Diego Bautista Urbaneja, Lechería, Anzoategui",85.0,72.0,72.0,,,,False
Apartamento En Venta,Conveniente Apartamento En El Conjunto Residencial Madre Vieja,"Av. Costanera, Diego Bautista Urbaneja, Lechería, Anzoategui",26000.0,0.0,92.0,,,,False
Local En Renta,"Local Comercial De 97m2 En Alquiler, Moderno Y Con Acabados De Primera","Avenida Bolivar, cruce con calle los almendrones, Diego Bautista Urbaneja, Lechería, Anzoategui",950.0,97.0,97.0,,,,False
Oficinas En Venta,Oficina En Venta En El Centro Empresarial Colon,"calle Arismendi, Diego Bautista Urbaneja, Lechería, Anzoategui",120000.0,57.0,57.0,,,,False
Casa En Venta,CASA EN VENTA EN EL CR CASAS BOTES C,"Octavio Camejo, Diego Bautista Urbaneja, Lechería, Anzoategui",350000.0,215.0,215.0,,,,False
Casa En Renta,CASA EN ALQUILER EN LECHERIA CR CASAS BOTES C,"Octavio Camejo, Diego Bautista Urbaneja, Lechería, Anzoategui",2000.0,215.0,215.0,,,,False
Apartamento En Renta,Apartamento Moderno En Alquiler En Conjunto Residencial Punta Canal,"Diego Bautista Urbaneja, Lechería, Anzoategui",1000.0,82.0,82.0,2.0,2.0,2.0,True
Apartamento En Renta,Hermoso Apartamento En La Avenida Bolivar De Lechería Residencias Karol,"AV BOLIVAR, Diego Bautista Urbaneja, Lechería, Anzoategui",450.0,75.0,75.0,,,,False
Apartamento En Renta,Apartamento En Alquiler,"Complejo Turistico El Morro, Diego Bautista Urbaneja, Lechería, Anzoategui",1400.0,112.0,112.0,3.0,2.0,2.0,True
Apartamento En Venta,Exclusivo Apartamento En Residencias Lido Suites,"8 la cuidad de Lecheria, Diego Bautista Urbaneja, Lechería, Anzoategui",100000.0,70.0,70.0,2.0,2.0,2.0,True
Apartamento En Venta,Apartamento En Venta 3 Habitaciones Lechería,"Sector Venecia, Diego Bautista Urbaneja, Lechería, Anzoategui",19000.0,86.0,86.0,,,,False
Local En Renta,Te Ofrece En Alquiler Local Comercial En Lecheria,"carrera 7 con carrera 5, Diego Bautista Urbaneja, Lechería, Anzoategui",250.0,28.0,28.0,,,,False
Town House En Renta,Bello Townhouse En Alquiler En Aguamarina,"Diego Bautista Urbaneja, Lechería, Anzoategui",700.0,103.0,103.0,3.0,2.0,2.0,True
Apartamento En Venta,VENTA APARTAMENTO EN CONJ RESD LAS MARINAS LECHERIA,"Diego Bautista Urbaneja, Lechería, Anzoategui",100000.0,84.0,84.0,,,,False
Casa En Renta,Villa Para Alquiler En Cayo De Agua,"Calle Principal, Diego Bautista Urbaneja, Lechería, Anzoategui",1500.0,132.0,132.0,,,,False
Casa En Renta,En Alquiler Hermosa Y Comoda Casas Bote B,"Av Daniel Camejo Octavio, Diego Bautista Urbaneja, Lechería, Anzoategui",800.0,202.0,202.0,3.0,3.0,1.0,True
Apartamento En Venta,APARTAMENTO EN VENTA LECHERIA EDIFICIO TOSCANA,"CASCO CENTRAL, Diego Bautista Urbaneja, Lechería, Anzoategui",55000.0,63.0,63.0,,,,False
Apartamento En Renta,"Apartamento En Residencial Punta Marina, Lechería","el morro, Diego Bautista Urbaneja, Lechería, Anzoategui",1300.0,117.0,117.0,3.0,4.0,2.0,True
Casa En Venta,Amplia Casa Ubicada Detrás Del Centro Comercial Mar Pacifico En Lecheria,"Calle Los Apamates, Diego Bautista Urbaneja, Lechería, Anzoategui",125000.0,235.0,235.0,,,,False
Apartamento En Renta,HERMOSO Y COMODO APARTAMENTO AMOBLADO Y EQUIPADO EN ALQUILER LECHERIA,"AV R16, Diego Bautista Urbaneja, Lechería, Anzoategui",800.0,72.0,72.0,2.0,2.0,2.0,False
Local En Renta,AMPLIO LOCAL COMERCIAL PLANTA BAJA EN ALQUILER MAR PACIFICO LECHERIA,"AV PRINCIPAL LECHERIA, Diego Bautista Urbaneja, Lechería, Anzoategui",1200.0,85.0,85.0,,,,False
Apartamento En Venta,APARTAMENTO EN VENTA EN LECHERIA C.R CHIMANA,"AV AMERICO VESPUCIO, Diego Bautista Urbaneja, Lechería, Anzoategui",220000.0,238.0,238.0,,,,False
Apartamento En Renta,Se Ofrece En Alquiler Un Cómodo Apartamento En Residencias Pocholo,"Diego Bautista Urbaneja, Lechería, Anzoategui",400.0,82.0,82.0,,,,False
Apartamento En Venta,Apartamento Para Remodelar Residencia Maya,"principal de lecheria, Diego Bautista Urbaneja, Lechería, Anzoategui",35000.0,113.0,113.0,1.0,2.0,1.0,False
Local En Renta,Consultorio Medico En Alquiler,"Calle Mariño, Diego Bautista Urbaneja, Lechería, Anzoategui",400.0,18.0,18.0,,,,False
Apartamento En Venta,BELLO APARTAMENTO EN AVENTURA PLAZA,"Avenida principal de Lechería, Diego Bautista Urbaneja, Lechería, Anzoategui",55000.0,75.0,75.0,2.0,2.0,1.0,False
Apartamento En Renta,"Hermoso Apartamento En La Mejor Zona De Lechería, Amoblado Y Equipado","Complejo Turístico el Morro, Diego Bautista Urbaneja, Lechería, Anzoategui",1500.0,90.0,90.0,2.0,2.0,2.0,True
Oficinas En Renta,Oficinas Centro Empresarial Colon,"Diego Bautista Urbaneja, Lechería, Anzoategui",650.0,57.0,57.0,,,,False
Galpon En Renta,Se Alquila Galpón En Lechería,"Arismendi, Diego Bautista Urbaneja, Lechería, Anzoategui",3000.0,800.0,800.0,,,,False
Apartamento En Venta,"En Venta Hermoso Apartamento En Res. Nicole Suites, Excelente Ubicacion","Calle arismendi, Diego Bautista Urbaneja, Lechería, Anzoategui",85000.0,173.0,173.0,5.0,3.0,2.0,False
Local En Renta,LOCAL CC ANNA,"avenida principal lecheria, Diego Bautista Urbaneja, Lechería, Anzoategui",500.0,50.0,50.0,,,,False
Local En Venta,Centro Comercial Palm Beach,"arismendi, Diego Bautista Urbaneja, Lechería, Anzoategui",70000.0,27.0,27.0,,,,False
Casa En Venta,CASA EN VENTA C.R CASAS BOTE B,"Octavio Camejo, Diego Bautista Urbaneja, Lechería, Anzoategui",220000.0,190.0,190.0,,,,False
Casa En Renta,CASA EN ALQUILERC.R CASAS BOTE B,"Octavio Camejo, Diego Bautista Urbaneja, Lechería, Anzoategui",1300.0,190.0,190.0,,,,False
Apartamento En Venta,Apartamento En Venta Residencias Karla Valentina Lecharía Anzoátegui,"Playa mansa Av. BOULEVARD, con Avenida piritu urbanización el morro, Diego Bautista Urbaneja, Lechería, Anzoategui",65000.0,125.0,125.0,,,,False
Apartamento En Venta,Moderno Y Acojedor Apartamento En El Conjunto Residencial Albacora,"Av. Libertad, Diego Bautista Urbaneja, Lechería, Anzoategui",150000.0,0.0,180.0,,,,False
Apartamento En Renta,Amplio Apartamento En Alquiler En El Conjunto Residencial Isla Marina,"Av. La Costa, Diego Bautista Urbaneja, Lechería, Anzoategui",2000.0,0.0,168.0,4.0,3.0,1.0,True
Apartamento En Venta,CONJUNTO RESIDENCIAL PLAYA MAR - CÁLIDA VISTA AL MAR.,"Avenida principal aguavilla lecheria, Diego Bautista Urbaneja, Lechería, Anzoategui",89000.0,106.0,106.0,,,,False
Apartamento En Venta,Hermoso Apartamento En El Conjunto Residencial Pueblo Viejo,"AV. AMÉRICO VESPUCIO, Diego Bautista Urbaneja, Lechería, Anzoategui",60000.0,56.0,58.0,1.0,1.0,1.0,False
Apartamento En Venta,El Hogar Que Sueñas En La Ciudad De Lecheria,"Arismendi, Diego Bautista Urbaneja, Lechería, Anzoategui",95000.0,100.0,100.0,3.0,3.0,2.0,True
Local En Renta,Local Comercial Con Excelente Ubicación Centro Comercial Aventura Plaza,"Avenida Principal, Diego Bautista Urbaneja, Lechería, Anzoategui",250.0,10.0,10.0,,,,False
Town House En Renta,Remodelada Y A Estrenar TH En Puerto Príncipe En Alquiler,"Diego Bautista Urbaneja, Lechería, Anzoategui",800.0,125.0,125.0,3.0,2.0,1.0,True
Town House En Venta,Remodelada Y A Estrenar TH En Puerto Principe En Venta,"Puerto Principe, Diego Bautista Urbaneja, Lechería, Anzoategui",117000.0,125.0,125.0,3.0,2.0,1.0,True
Apartamento En Venta,Cómodo Apartamento En Venta Planta Baja,"Sector el Peñonal, Diego Bautista Urbaneja, Lechería, Anzoategui",45000.0,75.0,75.0,,,,False
Local En Renta,Local Centro Comercial Armas,"calle 5, Diego Bautista Urbaneja, Lechería, Anzoategui",250.0,16.0,16.0,,,,False
Apartamento En Renta,CONJUNTO RESIDENCIAL MARINA MAR,"SECTOR LA PENINSULA, Diego Bautista Urbaneja, Lechería, Anzoategui",180.0,229.0,229.0,,,,False
Town House En Venta,CONJUNTO RESIDENCIAL VILLA MARTINIQUE,"AVENIDA R-16, Diego Bautista Urbaneja, Lechería, Anzoategui",95000.0,125.0,125.0,3.0,3.0,2.0,True
Apartamento En Renta,RESIDENCIAS PELICANO,"AMERICO VESPUCIO, Diego Bautista Urbaneja, Lechería, Anzoategui",450.0,89.0,89.0,,,,False
Apartamento En Venta,SE Vende Apartamento En Playa Lido. Residencia La Esmeralda,"PLAYA LIDO, Diego Bautista Urbaneja, Lechería, Anzoategui",37000.0,43.0,43.0,1.0,1.0,1.0,False
Town House En Venta,Town House En Venta En El Conjunto Residencial Cayo De Agua,"AMERICO VESPUCIO, Diego Bautista Urbaneja, Lechería, Anzoategui",130000.0,140.0,140.0,4.0,3.0,1.0,True
Apartamento En Venta,Amplio Y Cómodo Apartamento Con Ubicación Estratégica,"Calle El Dorado, Diego Bautista Urbaneja, Lechería, Anzoategui",43000.0,87.0,87.0,,,,False
Apartamento En Renta,RESIDENCIAS ISAJOR,"calle nueva esparta cruce con calle la marina, Diego Bautista Urbaneja, Lechería, Anzoategui",300.0,55.0,55.0,,,,False
Apartamento En Venta,Inmueble De Lujo Con Acabados De Lujo,"Av Costanera, Diego Bautista Urbaneja, Lechería, Anzoategui",145000.0,99.0,99.0,,,,False
Town House En Venta,HERMOSA CASA EN PUERTO PRINCIPE,"AVENIDA CAMEJO OCTAVIO, Diego Bautista Urbaneja, Lechería, Anzoategui",240000.0,121.0,250.0,4.0,4.0,1.0,False
Apartamento En Venta,"A Estrenar Con Acabados De Primera, En Lecheria","Av Costanera, Diego Bautista Urbaneja, Lechería, Anzoategui",55000.0,86.0,86.0,,,,False
Oficinas En Venta,Oficina Corporativa En Torre BVC,"Avenida Intercomunal Jorge Rodriguez, Diego Bautista Urbaneja, Lechería, Anzoategui",930000.0,1.059,1.059,,,,False
Edificio En Venta,"En Alquiler, Local De 45mts, 1 P/E , 1 Baño","CALLES LAS PEÑAS, Diego Bautista Urbaneja, Lechería, Anzoategui",49500.0,45.0,45.0,,,,False
Local En Venta,"En Venta Local Comercial De 52 Mts, 1 Baños, 1 Puesto De Estacionamiento","Calle las Peñas, Diego Bautista Urbaneja, Lechería, Anzoategui",57500.0,52.0,52.0,,,,False
Casa Bote En Renta,CASA EN CASAS BOTE C,"Avenida Daniel Camejo Octavio, Diego Bautista Urbaneja, Lechería, Anzoategui",1100.0,140.0,140.0,3.0,4.0,2.0,False
Apartamento En Renta,APARTAMENTO VACACIONAL EN PUERTO PRINCIPE,"AVENIDA DANIEL CAMEJO OCTAVIO, Diego Bautista Urbaneja, Lechería, Anzoategui",70.0,70.0,70.0,2.0,2.0,2.0,True
Apartamento En Renta,APARTAMENTO VACACIONAL EN AVILAMARES,"AVENIDA R16, Diego Bautista Urbaneja, Lechería, Anzoategui",750.0,160.0,90.0,2.0,2.0,1.0,False
Town House En Renta,TOWNHOUSE EN ALQUILER VACACIONAL EN LECHERIA C.R VILLAS MARTINIQUE,"AV R-16, Diego Bautista Urbaneja, Lechería, Anzoategui",130.0,125.0,125.0,,,,False
Town House En Renta,TOWNHOUSE EN ALQUILER EN LECHERIA C.R VILLAS MARTINIQUE,"AV R-16, Diego Bautista Urbaneja, Lechería, Anzoategui",1100.0,125.0,125.0,3.0,3.0,0.0,False
Local En Venta,En Venta Local Comercial Ubicado En El C.C. PEÑON DEL FARO De Lecheria,"Sector Peñonal, Diego Bautista Urbaneja, Lechería, Anzoategui",25000.0,30.0,30.0,,,,False
Apartamento En Venta,"Apartamento Penhouse En Residencias Avenida, Puerto La Cruz","Principal de Lecheria, Diego Bautista Urbaneja, Lechería, Anzoategui",14000.0,111.0,111.0,,,,False
Apartamento En Renta,Apartamento Vacacional En El Exclusivo Conjunto Residencial Marina Del Rey,"Diego Bautista Urbaneja, Lechería, Anzoategui",100.0,0.0,66.0,2.0,2.0,2.0,True
Apartamento En Renta,APARTAMENTO EN PUEBLO VIEJO,"Avenida Americo Vespucio, Diego Bautista Urbaneja, Lechería, Anzoategui",900.0,72.0,72.0,2.0,2.0,2.0,False
Casa Bote En Venta,Venta Casa Bote C,"00, Diego Bautista Urbaneja, Lechería, Anzoategui",99500.0,206.0,120.0,,,,False
Town House En Venta,TownHouse En Venta En La Ciudad De Lechería En El CR. Costa Del Sol.,"R - 8, Diego Bautista Urbaneja, Lechería, Anzoategui",150000.0,135.0,134.0,3.0,3.0,2.0,True
Penthouse En Venta,PH En Residencia Karla - Valentina,"Avenida Blvd, Diego Bautista Urbaneja, Lechería, Anzoategui",145000.0,475.0,475.0,4.0,4.0,2.0,True
Apartamento En Renta,Apartamento En El C.R Entremares,"Las Palmeras, Diego Bautista Urbaneja, Lechería, Anzoategui",550.0,56.0,56.0,,,,False
Oficinas En Venta,En Venta Oficina En Centro Comercial Plaza Mayor,"Diego Bautista Urbaneja, Lechería, Anzoategui",40000.0,41.0,41.0,,,,False
Apartamento En Venta,En Venta Bello Apartamento En Costa Guaica,"Av. Costanera, Diego Bautista Urbaneja, Lechería, Anzoategui",42800.0,88.0,88.0,2.0,2.0,2.0,False
Apartamento En Venta,CONJUNTO RESIDENCIAL LAS SALINAS,"prolongacon arismendi, Diego Bautista Urbaneja, Lechería, Anzoategui",45000.0,86.0,86.0,,,,False
Apartamento En Venta,"Apartamento En Obra Avanzada ,Conjunto Residencial Azulejos","lecheria, Diego Bautista Urbaneja, Lechería, Anzoategui",33800.0,85.0,85.0,3.0,2.0,2.0,False
Apartamento En Renta,"Moderno Apartamento En El C.R Marina Del Rey, Lechería Anzoátegui","Complejo Turistico el Morro Lecheria, Diego Bautista Urbaneja, Lechería, Anzoategui",550.0,66.0,66.0,,,,False
Apartamento En Venta,Conjunto Residencial Rebecca,"lecheria, Diego Bautista Urbaneja, Lechería, Anzoategui",120000.0,228.0,228.0,4.0,3.0,3.0,False
Casa En Venta,En Venta Casa En El Prestigioso Conjunto Residencial Las Villas. Lechería.,"Avenida Daniel Camejo Octavio, Diego Bautista Urbaneja, Lechería, Anzoategui",480000.0,1.0,600.0,,,,False
Apartamento En Venta,Hermoso Y Amplio Apartamento Amoblado Y Equipado Ubicado En Lechería,"Avenida R-8, Diego Bautista Urbaneja, Lechería, Anzoategui",260000.0,148.0,148.0,,,,False
Apartamento En Renta,Amplio Apartamento Planta Baja En Exclusivo Conjunto Residencial Siete Mares,"av r-8, Diego Bautista Urbaneja, Lechería, Anzoategui",1580.0,145.0,145.0,3.0,3.0,2.0,False
Apartamento En Venta,Apartamento En Venta Conjunto Residencial Venecia Lechera,"Avenida Nueva Esparta, cruce con Cerro Sur, sector Venecia Lecheria, Diego Bautista Urbaneja, Lechería, Anzoategui",28000.0,85.0,85.0,,,,False
Apartamento En Venta,"Lechería, Res. Vista Bella. Av. Bolívar.","calle arismendi, Diego Bautista Urbaneja, Lechería, Anzoategui",130000.0,255.0,255.0,4.0,4.0,2.0,False
Apartamento En Renta,"En Alquiler Apartamento En Res, Coral Suites Con Excelente Ubicacion","av guzman lander, Diego Bautista Urbaneja, Lechería, Anzoategui",300.0,60.0,60.0,,,,False
Apartamento En Venta,Venta Hermoso Apartamento Conj Res Vistamar,"Intersección Av Jorge Rodríguez con la antigua via que conduce a Lecheria, Diego Bautista Urbaneja, Lechería, Anzoategui",19800.0,67.0,67.0,,,,False
Town House En Venta,CENTURY21 VENECIA OFRECE VENTA TH MODERNO NEVADA PALACE CONJUNTO EXCLUSIVO LEC,"NEVERI, Diego Bautista Urbaneja, Lechería, Anzoategui",190000.0,230.0,230.0,5.0,2.0,3.0,False
Apartamento En Venta,En Venta Apartamento En Lechería. C.R. Puerto Banus,"AV R16, Diego Bautista Urbaneja, Lechería, Anzoategui",46000.0,72.0,72.0,2.0,2.0,1.0,True
Local En Venta,LOCAL EN VENTA O ALQUILER NEGOCIABLE,"peñon del faro, Diego Bautista Urbaneja, Lechería, Anzoategui",26000.0,10.0,24.0,,,,False
Apartamento En Venta,VENTA DE APARTAMENTO VILLASOL SUITES GOLF & BEACH,"AV AMERICO VESPUCIO, Diego Bautista Urbaneja, Lechería, Anzoategui",40000.0,53.0,53.0,,,,False
Apartamento En Venta,En Venta Apartamento En C.R Chimana Grande,"Avenida intercomunal, Diego Bautista Urbaneja, Lechería, Anzoategui",20000.0,81.0,81.0,3.0,2.0,1.0,False
Apartamento En Venta,Resedencia Flamingo,"R16, Diego Bautista Urbaneja, Lechería, Anzoategui",55000.0,70.0,70.0,,,,False
Casa En Venta,"VENDO CASA EN CASAS BOTE A, Sector Aquavilla","Sector Aquavilla, Diego Bautista Urbaneja, Lechería, Anzoategui",220000.0,203.0,196.0,,,,False
Casa En Renta,Villa Ideal Para Vacacionar,"Avenida Camejo Octavio, Diego Bautista Urbaneja, Lechería, Anzoategui",1150.0,1.0,1.7,,,,False
Local En Venta,Local Comercial El Peñon,"peñon del faro, Diego Bautista Urbaneja, Lechería, Anzoategui",26000.0,21.0,21.0,,,,False
Apartamento En Venta,Apartamento Lecheria,"ARISMENDI, Diego Bautista Urbaneja, Lechería, Anzoategui",80000.0,125.0,125.0,,,,False
Apartamento En Venta,VENTA DE PRESTIGISO APARTAMENTO EN LAS MARINAS LECHERIAS,"COMPLEJOTURISTICO EL MORRO, Diego Bautista Urbaneja, Lechería, Anzoategui",125000.0,112.0,112.0,,,,False
Apartamento En Venta,CENTURY21 VENECIA OFRECE APARTAMENTO VENTA PLANTA BAJA C.R LAS MARINAS LECHERIA,"avenida r8, Diego Bautista Urbaneja, Lechería, Anzoategui",110000.0,90.0,90.0,2.0,2.0,1.0,False
Apartamento En Venta,COMODO APARTAMENTO EN VENTA LECHERIA,"AV R16, Diego Bautista Urbaneja, Lechería, Anzoategui",45000.0,52.0,52.0,1.0,1.0,1.0,True
Casa En Venta,CENTURY21 VENECIA OFRECE VENTA CASA LAS VILLAS CAMPO DE GOLF REMODELADA 440000,"LAS VILLAS LECHERIA, Diego Bautista Urbaneja, Lechería, Anzoategui",440000.0,1.084,450.0,,,,False
Apartamento En Renta,Se Alquila Apartamento Res. Villamar,"sector Cerro El Morro, Diego Bautista Urbaneja, Lechería, Anzoategui",400.0,70.0,70.0,1.0,1.0,1.0,True
Apartamento En Venta,APARTAMENTO EN VENTA EN LECHERIA CR ENTREMARES,"AV AMERICO VESPUCIO, Diego Bautista Urbaneja, Lechería, Anzoategui",65000.0,41.0,41.0,,,,False
Apartamento En Renta,APARTAMENTO EN ALQUILER VACACIONAL EN LECHERIA CR ENTREMARES,"AV AMERICO VESPUCIO, Diego Bautista Urbaneja, Lechería, Anzoategui",100.0,41.0,41.0,1.0,1.0,1.0,True
Local En Renta,Local Comercial En Alquiler En Lechería AV Anozategui,"av anzoategui, Diego Bautista Urbaneja, Lechería, Anzoategui",1500.0,186.0,186.0,,,,False
Casa En Venta,CASAS BOTES C,"Diego Bautista Urbaneja, Lechería, Anzoategui",280000.0,203.0,194.0,5.0,4.0,3.0,False
Apartamento En Renta,Conveniente Y Exclusivo Apartamento En El Conjunto Residencial Villa Solarieaga,"Av. Americo Vespucio, Diego Bautista Urbaneja, Lechería, Anzoategui",300.0,0.0,41.0,1.0,1.0,1.0,True
Local En Renta,Alquiler Local Comercial 40 M2 Avenida Principal De Lecheria,"Av principal de Lecheria, Diego Bautista Urbaneja, Lechería, Anzoategui",500.0,40.0,40.0,,,,False
Apartamento En Venta,"Apartamento En El Conjunto Residencial Terrazas Del Sol, Sector Pascal","Av. Intercomunal, Diego Bautista Urbaneja, Lechería, Anzoategui",25000.0,95.0,95.0,,,,False
